Titel,Autor,Jahr,Journal,Typ,DOI
laparoscopic training exercises using htc vive,"chaudhary, ayesha hoor; bukhari, faisal; iqbal, waheed; nawaz, zubair; malik, muhammad kamran",2020,intelligent automation and soft computing,,10.31209/2019.100000149
implementation of local area vr environment using mobile hmd and multiple kinects,"kim, soo-kyun; lee, chang-hee; kim, sun-jeong; song, chang-geun; lee, jung",2020,intelligent automation and soft computing,,10.31209/2019.100000131
distinction between real faces and photos by analysis of face data,"lee, byong kwon; lee, yang sun",2020,intelligent automation and soft computing,,10.31209/2019.100000134
cognitive load and performance in immersive virtual reality versus conventional virtual reality simulation training of laparoscopic surgery: a randomized trial,"frederiksen, joakim grant; sorensen, stine maya dreier; konge, lars; svendsen, morten bo sondergaard; nobel-jorgensen, morten; bjerrum, flemming; andersen, steven arild wuyts",2020,surgical endoscopy and other interventional techniques,,10.1007/s00464-019-06887-8
tracking attacks on virtual reality systems,"rafique, muhammad usman; cheung, sen-ching s.",2020,ieee consumer electronics magazine,,10.1109/MCE.2019.2953741
advantages and limits of virtual reality in learning processes: briviesca in the fifteenth century,"checa, david; bustillo, andres",2020,virtual reality,,10.1007/s10055-019-00389-7
the relationship between disgust sensitivity and behaviour: a virtual reality study on food disgust,"ammann, jeanine; hartmann, christina; peterhans, vega; ropelato, sandro; siegrist, michael",2020,food quality and preference,,10.1016/j.foodqual.2019.103833
cybersickness in virtual reality head-mounted displays: examining the influence of sex differences and vehicle control,"curry, christopher; li, ruixuan; peterson, nicolette; stoffregen, thomas a.",2020,international journal of human-computer interaction,,10.1080/10447318.2020.1726108
relationship between ocular fatigue and use of a virtual reality device,"lee, sang hyeok; kim, martha; kim, hyosun; park, choul yong",2020,journal of the korean ophthalmological society,,10.3341/jkos.2020.61.2.125
depth perception in shuffleboard: depth cues effect on depth perception in virtual and augmented reality system,"ping, jiamin; weng, dongdong; liu, yue; wang, yongtian",2020,journal of the society for information display,,10.1002/jsid.840
the challenges of using head mounted virtual reality in k-12 schools from a teacher perspective,"fransson, goran; holmberg, jorgen; westelius, claes",2020,education and information technologies,,10.1007/s10639-020-10119-1
older adults with cognitive and/or physical impairments can benefit from immersive virtual reality experiences: a feasibility study,"appel, lora; appel, eva; bogler, orly; wiseman, micaela; cohen, leedan; ein, natalie; abrams, howard b.; campos, jennifer l.",2020,frontiers in medicine,,10.3389/fmed.2019.00329
exploring virtual reality experiences of slum tourism,"griffin, tom; muldoon, meghan",2020,tourism geographies,,10.1080/14616688.2020.1713881
simulation and measurement: feasibility study of tactile internet applications for mmwave virtual reality,"na, woongsoo; dao, nhu-ngoc; kim, joongheon; ryu, eun-seok; cho, sungrae",2020,etri journal,,10.4218/etrij.2019-0284
motor program transformation of throwing dart from the third-person perspective,"tumialis, alexey; smirnov, alexey; fadeev, kirill; alikovskaia, tatiana; khoroshikh, pavel; sergievich, alexander; golokhvast, kirill",2020,brain sciences,,10.3390/brainsci10010055
alohomora: motion-based hotword detection in head-mounted displays,"gu, jiaxi; yu, zhiwen; shen, kele",2020,ieee internet of things journal,,10.1109/JIOT.2019.2946593
use of commercial virtual reality technology to assess verticality perception in static and dynamic visual backgrounds,"zaleski-king, ashley; pinto, robin; lee, general; brungart, douglas",2020,ear and hearing,,10.1097/AUD.0000000000000736
simplified virtual reality training system for radiation shielding and measurement in nuclear engineering,"hagita, katsumi; kodama, yuuki; takada, masashi",2020,progress in nuclear energy,,10.1016/j.pnucene.2019.103127
calibration and evaluation for visuo-haptic collocation in haptic augmented virtuality systems,"bae, yoosung; cha, baekdong; ryu, jeha",2020,international journal of control automation and systems,,10.1007/s12555-018-0882-3
a virtual reality role-playing serious game for experiential learning,"alrehaili, enas abdulrahman; al osman, hussein",2019,interactive learning environments,,10.1080/10494820.2019.1703008
an environmental scan of virtual and augmented reality services in academic libraries,"greene, david; groenendyk, michael",2019,library hi tech,,10.1108/LHT-08-2019-0166
a quantitative method for evaluation of 6 degree of freedom virtual reality systems,"jost, tyler a.; drewelow, grant; koziol, scott; rylander, jonathan",2019,journal of biomechanics,,10.1016/j.jbiomech.2019.109379
"effects of postural stability, active control, exposure duration and repeated exposures on hmd induced cybersickness","risi, dante; palmisano, stephen",2019,displays,,10.1016/j.displa.2019.08.003
virtual reality human-robot collaborative welding: a case study of weaving gas tungsten arc welding,"wang, qiyue; cheng, yongchao; jiao, wenhua; johnson, michael t.; zhang, yuming",2019,journal of manufacturing processes,,10.1016/j.jmapro.2019.10.016
weighting and reweighting of visual input via head mounted display given unilateral peripheral vestibular dysfunction,"lubetzky, anat v.; harel, daphna; kelly, jennifer; hujsak, bryan d.; perlin, ken",2019,human movement science,,10.1016/j.humov.2019.102526
the validity of an oculus rift to assess postural changes during balance tasks,"marchetto, jonathan; wright, w. geoffrey",2019,human factors,,10.1177/0018720819835088
do virtual reality head-mounted displays make a difference? a comparison of presence and self-efficacy between head-mounted displays and desktop computer-facilitated virtual environments,"shu, yu; huang, yen-zhang; chang, shu-hsuan; chen, mu-yen",2019,virtual reality,,10.1007/s10055-018-0376-x
transforming earth science education through immersive experiences: delivering on a long held promise,"klippel, alexander; zhao, jiayan; jackson, kathy lou; la femina, peter; stubbs, chris; wetzel, ryan; blair, jordan; wallgrun, jan oliver; oprean, danielle",2019,journal of educational computing research,,10.1177/0735633119854025
game play in virtual reality driving simulation involving head-mounted display and comparison to desktop display,"cao, shi; nandakumar, krithika; babu, raiju; thompson, benjamin",2019,virtual reality,,10.1007/s10055-019-00412-x
real-time volume rendering interaction in virtual reality,"kalarat, kosin; koomhin, phanit",2019,international journal of technology,,10.14716/ijtech.v10i7.3259
validation of the virtual reality neuroscience questionnaire: maximum duration of immersive virtual reality sessions without the presence of pertinent adverse symptomatology,"kourtesis, panagiotis; collina, simona; doumas, leonidas a. a.; macpherson, sarah e.",2019,frontiers in human neuroscience,,10.3389/fnhum.2019.00417
the impact of the input interface in a virtual environment: the vive controller and the myo armband,"de paolis, lucio tommaso; de luca, valerio",2019,virtual reality,,10.1007/s10055-019-00409-6
estimating cognitive workload in an interactive virtual reality environment using eeg,"tremmel, christoph; herff, christian; sato, tetsuya; rechowicz, krzysztof; yamani, yusuke; krusienski, dean j.",2019,frontiers in human neuroscience,,10.3389/fnhum.2019.00401
quantitative analysis of the oculus rift s in controlled movement,"jost, tyler a.; nelson, bradley; rylander, jonathan",2019,disability and rehabilitation-assistive technology,,10.1080/17483107.2019.1688398
the application of augmented reality and unity 3d in interaction with intangible cultural heritage,"huang, weibo; xiang, handun; li, shaohui",2019,evolutionary intelligence,,10.1007/s12065-019-00314-6
effects of steering locomotion and teleporting on cybersickness and presence in hmd-based virtual reality,"clifton, jeremy; palmisano, stephen",2019,virtual reality,,10.1007/s10055-019-00407-8
mobile-powered head-mounted displays versus cave automatic virtual environment experiments for evacuation research,"ronchi, enrico; mayorga, david; lovreglio, ruggiero; wahlqvist, jonathan; nilsson, daniel",2019,computer animation and virtual worlds,,10.1002/cav.1873
a novel head mounted display based methodology for balance evaluation and rehabilitation,"lee, eun-young; tran, van thanh; kim, dongho",2019,sustainability,,10.3390/su11226453
virtual reality gaming elevates heart rate but not energy expenditure compared to conventional exercise in adult males,"perrin, theo; faure, charles; nay, kevin; cattozzo, giammaria; sorel, anthony; kulpa, richard; kerherve, hugo a.",2019,international journal of environmental research and public health,,10.3390/ijerph16224406
virtual skills training: the role of presence and agency,"piccione, joseph; collett, james; de foe, alexander",2019,heliyon,,10.1016/j.heliyon.2019.e02583
feasibility of eye tracking assisted vestibular rehabilitation strategy using immersive virtual reality,"park, jeong hye; jeon, han jae; lim, eun-cheon; koo, ja-won; lee, hyo-jeong; kim, hyung-jong; lee, jung seop; song, chang-geun; hong, sung kwang",2019,clinical and experimental otorhinolaryngology,,10.21053/ceo.2018.01592
"the effects of viewing smart devices on static balance, oculomotor function, and dizziness in healthy adults","lee, donggeon; hong, soungkyun; jung, sunhye; lee, kyeongbong; lee, gyuchang",2019,medical science monitor,,10.12659/MSM.915284
exploration of temporal bone anatomy using mixed reality (hololens): development of a mixed reality anatomy teaching resource prototype,"maniam, pavithran; schnell, philipp; dan, lilly; portelli, rony; erolin, caroline; mountain, rodney; wilkinson, tracey",2020,journal of visual communication in medicine,,10.1080/17453054.2019.1671813
advantages of using 3d virtual reality based training in persons with parkinson's disease: a parallel study,"cikajlo, imre; potisk, karmen peterlin",2019,journal of neuroengineering and rehabilitation,,10.1186/s12984-019-0601-1
rolevr: multi-experience in immersive virtual reality between co-located hmd and non-hmd users,"lee, jiwon; kim, mingyu; kim, jinmo",2020,multimedia tools and applications,,10.1007/s11042-019-08220-w
a case study of immersive virtual field trips in an elementary classroom: students' learning experience and teacher-student interaction behaviors,"cheng, kun-hung; tsai, chin-chung",2019,computers & education,,10.1016/j.compedu.2019.103600
communicating and controlling robot arm motion intent through mixed-reality head-mounted displays,"rosen, eric; whitney, david; phillips, elizabeth; chien, gary; tompkin, james; konidaris, george; tellex, stefanie",2019,international journal of robotics research,,10.1177/0278364919842925
user-centered interior finishing material selection: an immersive virtual reality-based interactive approach,"zhang, yuxuan; liu, hexu; zhao, mingjun; al-hussein, mohamed",2019,automation in construction,,10.1016/j.autcon.2019.102884
automatic calibration of a six-degrees-of-freedom pose estimation system,"jansen, wouter; laurijssen, dennis; daems, walter; steckel, jan",2019,ieee sensors journal,,10.1109/JSEN.2019.2921644
i'm a computer scientist!: virtual reality experience influences stereotype threat and stem motivation among undergraduate women,"starr, christine r.; anderson, barrett r.; green, katherine a.",2019,journal of science education and technology,,10.1007/s10956-019-09781-z
spatial perception of ceiling height and type variation in immersive virtual environments,"cha, seung hyun; koo, choongwan; kim, tae wan; hong, taehoon",2019,building and environment,,10.1016/j.buildenv.2019.106285
bringing the outside in: the feasibility of virtual reality with people with dementia in an inpatient psychiatric care setting,"rose, vienna; stewart, inga; jenkins, keith g.; tabbaa, luma; ang, chee siang; matsangidou, maria",2019,dementia-international journal of social research and practice,,10.1177/1471301219868036
"using virtual reality head-mounted displays in schools with autistic children: views, experiences, and future directions","newbutt, nigel; bradley, ryan; conley, iian",2020,cyberpsychology behavior and social networking,,10.1089/cyber.2019.0206
an immersive virtual reality platform for assessing spatial navigation memory in predementia screening: feasibility and usability study,"ijaz, kiran; ahmadpour, naseem; naismith, sharon l.; calvo, rafael a.",2019,jmir mental health,,10.2196/13887
transverse chromatic aberration in virtual reality head-mounted displays,"beams, ryan; kim, andrea s.; badano, aldo",2019,optics express,,10.1364/OE.27.024877
augmented experiences: investigating the feasibility of virtual reality as part of a workplace wellbeing intervention,"naylor, matthew; morrison, ben; ridout, brad; campbell, andrew",2019,interacting with computers,,10.1093/iwc/iwz033
emotional evaluation for pictures displayed with small fov telescope environment in virtual reality headset,"yamaguchi, masahiro; matsumura, masayo; shimada, hikari; araki, kenji",2019,artificial life and robotics,,10.1007/s10015-019-00536-y
estimating forearm axial rotation using vive trackers for interaction with serious games,"nai, weizhi; feng, junyan; shan, ling; jia, feiyong; sun, minghui; sun, xiaoying",2019,ieee transactions on neural systems and rehabilitation engineering,,10.1109/TNSRE.2019.2931778
behavioural intentions of using virtual reality in learning: perspectives of acceptance of information technology and learning style,"shen, chien-wen; ho, jung-tsung; pham thi minh ly; kuo, ting-chang",2019,virtual reality,,10.1007/s10055-018-0348-1
an olfactory display to study the integration of vision and olfaction in a virtual reality environment,"micaroni, lorenzo; carulli, marina; ferrise, francesco; gallace, alberto; bordegoni, monica",2019,journal of computing and information science in engineering,,10.1115/1.4043068
evaluation of a virtual reality head mounted display as a tool for posture assessment in digital human modelling software,"rizzuto, michael a.; sonne, michael w. l.; vignais, nicolas; keir, peter j.",2019,applied ergonomics,,10.1016/j.apergo.2019.04.001
effects of travel modes on performances and user comfort: a comparison between armswinger and teleporting,"loup, guillaume; loup-escande, emilie",2019,international journal of human-computer interaction,,10.1080/10447318.2018.1519164
"cycling and spatial navigation in an enriched, immersive 3d virtual park environment: a feasibility study in younger and older adults","sakhare, ashwin r.; yang, vincent; stradford, joy; tsang, ivan; ravichandran, roshan; pa, judy",2019,frontiers in aging neuroscience,,10.3389/fnagi.2019.00218
effects of initial starting distance and gap characteristics on children's and young adults' velocity regulation when intercepting moving gaps,"chung, hyun chae; choi, gyoojae; azam, muhammad",2019,human factors,,10.1177/0018720819867501
visual stabilization of balance in virtual reality using the htc vive,"kelly, jonathan w.; klesel, brenna c.; cherep, lucia a.",2019,acm transactions on applied perception,,10.1145/3313902
impact of different immersive techniques on the perceived sense of presence measured via subjective scales,"yildirim, cagdas; bostan, barbaros; berkman, mehmet ilker",2019,entertainment computing,,10.1016/j.entcom.2019.100308
cue-elicited anxiety and alcohol craving as indicators of the validity of alco-vr software: a virtual reality study,"ghita, alexandra; hernandez-serrano, olga; fernandez-ruiz, yolanda; monras, miquel; ortega, lluisa; mondon, silvia; teixidor, lidia; gual, antoni; porras-garcia, bruno; ferrer-garcia, marta; gutierrez-maldonado, jose",2019,journal of clinical medicine,,10.3390/jcm8081153
digital restoration of fragmentary human skeletal remains: testing the feasibility of virtual reality,"jurda, mikolas; urbanova, petra; chmelik, jiri",2019,journal of forensic and legal medicine,,10.1016/j.jflm.2019.06.005
examining the impact of head-mounted display virtual reality on the science self-efficacy of high schoolers,"huang, wen",2019,interactive learning environments,,10.1080/10494820.2019.1641525
desktop vr is better than non-ambulatory hmd vr for spatial learning,"srivastava, priyanka; rimzhim, anurag; vijay, palash; singh, shruti; chandra, sushil",2019,frontiers in robotics and ai,,10.3389/frobt.2019.00050
collaborative educational environments incorporating mixed reality technologies: a systematic mapping study,"ali, almaas a.; dafoulas, georgios a.; augusto, juan carlos",2019,ieee transactions on learning technologies,,10.1109/TLT.2019.2926727
fixation detection with ray-casting in immersive virtual reality,"alghamdi, najood; alhalabi, wadee",2019,international journal of advanced computer science and applications,,0
effects of displays on a direct reaching task: a comparative study of head mounted display and stereoscopic widescreen display,"lin, chiuhsiang j.; abreham, betsha t.; woldegiorgis, bereket h.",2019,international journal of industrial ergonomics,,10.1016/j.ergon.2019.06.013
inception: virtual space in memory space in real space - memory forensics of immersive virtual reality with the htc vive,"casey, peter; lindsay-decusati, rebecca; baggili, ibrahim; breitinger, frank",2019,digital investigation,,10.1016/j.diin.2019.04.007
modeling of human welders' operations in virtual reality human-robot interaction,"wang, qiyue; jiao, wenhua; yu, rui; johnson, michael t.; zhang, yuming",2019,ieee robotics and automation letters,,10.1109/LRA.2019.2921928
postural stability predicts the likelihood of cybersickness in active hmd-based virtual reality,"arcioni, benjamin; palmisano, stephen; apthorp, deborah; kim, juno",2019,displays,,10.1016/j.displa.2018.07.001
vection does not necessitate visually induced motion sickness,"kuiper, ouren x.; bos, jelte e.; diels, cyriel",2019,displays,,10.1016/j.displa.2018.10.001
follow the smoke: immersive display of motion data with synthesized smoke,"zhu, lifeng; wang, zian; wang, yunhai; song, aiguo",2019,ieee computer graphics and applications,,10.1109/MCG.2019.2915717
accuracy assessment for the co-registration between optical and vive head-mounted display tracking,"groves, leah a.; carnahan, patrick; allen, daniel r.; adam, rankin; peters, terry m.; chen, elvis c. s.",2019,international journal of computer assisted radiology and surgery,,10.1007/s11548-019-01992-4
"exploring barriers to adoption of virtual reality through social media analytics and machine learning - an assessment of technology, network, price and trialability","laurell, christofer; sandstrom, christian; berthold, adam; larsson, daniel",2019,journal of business research,,10.1016/j.jbusres.2019.01.017
vestibular rehabilitation in older adults with and without mild cognitive impairment: effects of virtual reality using a head-mounted display,"micarelli, alessandro; viziano, andrea; micarelli, beatrice; augimeri, ivan; alessandrini, marco",2019,archives of gerontology and geriatrics,,10.1016/j.archger.2019.05.008
ar-ped: a framework of augmented reality enabled pedestrian-in-the-loop simulation,"perez, daniel; hasan, mahmud; shen, yuzhong; yang, hong",2019,simulation modelling practice and theory,,10.1016/j.simpat.2019.03.005
user-centred design of an active computer gaming system for strength and balance exercises for older adults,"howes, sarah c.; charles, darryl; pedlow, katy; wilson, iseult; holmes, dominic; mcdonough, suzanne",2019,journal of enabling technologies,,10.1108/JET-12-2018-0057
age-related differences with immersive and non-immersive virtual reality in memory assessment,"plechata, adela; sahula, vaclav; fayette, dan; fajnerova, iveta",2019,frontiers in psychology,,10.3389/fpsyg.2019.01330
comparison of visual fatigue caused by head-mounted display for virtual reality and two-dimensional display using objective and subjective evaluation,"hirota, masakazu; kanda, hiroyuki; endo, takao; miyoshi, tomomitsu; miyagawa, suguru; hirohara, yoko; yamaguchi, tatsuo; saika, makoto; morimoto, takeshi; fujikado, takashi",2019,ergonomics,,10.1080/00140139.2019.1582805
user color temperature preferences in immersive virtual realities,"siess, andreas; woelfe, matthias",2019,computers & graphics-uk,,10.1016/j.cag.2019.03.018
interactive physiotherapy: an application based on virtual reality and bio-feedback,"baqai, attiya; memon, khuhed; memon, azam rafique; shah, syed muhammad zaigham abbas",2019,wireless personal communications,,10.1007/s11277-018-5382-5
duisburg 1566: transferring a historic 3d city model from google earth into a virtual reality application,"tschirschwitz, felix; richerzhagen, christian; przybilla, heinz-juergen; kersten, thomas p.",2019,pfg-journal of photogrammetry remote sensing and geoinformation science,,10.1007/s41064-019-00065-0
virtual reality for individuals with substance use disorders,"worley, julie",2019,journal of psychosocial nursing and mental health services,,10.3928/02793695-20190430-01
a virtual reality environment to visualize three-dimensional patient-specific models by a mobile head-mounted display,"vertemati, maurizio; cassin, simone; rizzetto, francesco; vanzulli, angelo; elli, marco; sampogna, gianluca; gallieni, maurizio",2019,surgical innovation,,10.1177/1553350618822860
assessing hands-free interactions for vr using eye gaze and electromyography,"pai, yun suen; dingler, tilman; kunze, kai",2019,virtual reality,,10.1007/s10055-018-0371-2
real-time body tracking in virtual reality using a vive tracker,"caserman, polona; garcia-agundez, augusto; konrad, robert; goebel, stefan; steinmetz, ralf",2019,virtual reality,,10.1007/s10055-018-0374-z
evaluating the effects of collaboration and competition in navigation tasks and spatial knowledge acquisition within virtual reality environments,"liang, hai-ning; lu, feiyu; shi, yuwei; nanjappan, vijayakumar; papangelis, konstantinos",2019,future generation computer systems-the international journal of escience,,10.1016/j.future.2018.02.029
using low-cost virtual reality simulation to build surgical capacity for cervical cancer treatment,"bing, eric g.; parham, groesbeck p.; cuevas, anthony; fisher, boris; skinner, jonathan; mwanahamuntu, mulindi; sullivan, richard",2019,journal of global oncology,,10.1200/JGO.18.00263
screwing assembly oriented interactive model segmentation in hmd vr environment,"zhu, xiaoqiang; song, lei; wang, nan; zhang, ruiheng; chen, shenshuai; wang, xiangyang; zhu, mengyao; you, lihua; deng, zhigang; jin, xiaogang",2019,computer animation and virtual worlds,,10.1002/cav.1880
development of a virtual reality-based game approach for supporting sensory processing disorders treatment,"rossi, henrique; prates, raquel; santos, sibele; ferreira, renato",2019,information,,10.3390/info10050177
evaluating the usability of a second-generation virtual reality game for refreshing sterile urinary catheterization skills,"kardong-edgren, suzan; breitkreuz, karen; werb, michael; foreman, stephen; ellertson, anthony",2019,nurse educator,,10.1097/NNE.0000000000000570
vr exploration assistance through automatic occlusion removal,"wang, lili; wu, jian; yang, xuefeng; popescu, voicu",2019,ieee transactions on visualization and computer graphics,,10.1109/TVCG.2019.2898782
estimating vr sickness and user experience using different hmd technologies: an evaluation study,"somrak, andrej; humar, iztok; hossain, m. shamim; alhamid, mohammed f.; hossain, m. anwar; guna, joze",2019,future generation computer systems-the international journal of escience,,10.1016/j.future.2018.11.041
subjective and objective evaluation of water-supply and drainage noises in apartment buildings by using a head-mounted display,"jeon, jin yong; jo, hyun in; kim, sung min; yang, hong seok",2019,applied acoustics,,10.1016/j.apacoust.2018.12.037
consumer perceptions and purchase behavior toward imperfect fruits and vegetables in an immersive virtual reality grocery store,"lombart, cindy; milian, elena; normand, jean-marie; verhulst, adrien; labbe-pinlon, blandine; moreau, guillaume",2019,journal of retailing and consumer services,,10.1016/j.jretconser.2019.01.010
feasibility of using a fully immersive virtual reality system for kinematic data collection,"spitzley, kate a.; karduna, andrew r.",2019,journal of biomechanics,,10.1016/j.jbiomech.2019.02.015
the role of eeg and emg combined virtual reality gaming system in facial palsy rehabilitation - a case report,"qidwai, uvais; ajimsha, m. s.; shakir, mohamed",2019,journal of bodywork and movement therapies,,10.1016/j.jbmt.2019.02.012
aligning content rendering resolution and feature size with display capability in near-eye display systems,"hoffman, david m.; mckenzie, chris; koprowski, brion; iqbal, asif; balram, nikhil",2019,journal of the society for information display,,10.1002/jsid.765
a study on the presence of immersive user interface in collaborative virtual environments application,"park, wonjun; heo, hayoung; park, seongjun; kim, jinmo",2019,symmetry-basel,,10.3390/sym11040476
"far from paradise: the body, the apparatus and the image of contemporary virtual reality","golding, dan",2019,convergence-the international journal of research into new media technologies,,10.1177/1354856517738171
pilot assessment of immersive virtual reality renal models as an educational and preoperative planning tool for percutaneous nephrolithotomy,"parkhomenko, egor; o'leary, mitchell; safiullah, shoaib; walia, sartaaj; owyong, michael; lin, cyrus; james, ryan; okhunov, zhamshid; patel, roshan m.; kaler, kamaljot s.; landman, jaime; clayman, ralph",2019,journal of endourology,,10.1089/end.2018.0626
