Titel,Autor,Jahr,Journal,Typ,DOI
a comparative study of sense of presence of traditional virtual reality and immersive environments,"north, max m.; north, sarah",2016,australasian journal of information systems,,0
virtual reality systems enhance students' achievements in engineering education,"alhalabi, wadee s.",2016,behaviour & information technology,,10.1080/0144929X.2016.1212931
effects of real-world versus virtual environments on joint excursions in full-body reaching tasks,"thomas, james s.; france, christopher r.; leitkam, samuel t.; applegate, megan e.; pidcoe, peter e.; walkowski, stevan",2016,ieee journal of translational engineering in health and medicine-jtehm,,10.1109/JTEHM.2016.2623787
way-finding lighting systems for rail tunnel evacuation: a virtual reality experiment with oculus rift (r),"cosma, giovanni; ronchi, enrico; nilsson, daniel",2016,journal of transportation safety & security,,10.1080/19439962.2015.1046621
shopping in virtual reality stores: the influence of immersion on system adoption.,"peukert, christian; pfeiffer, jella; meiner, martin; pfeiffer, thies; weinhardt, christof",2019,journal of management information systems,,10.1080/07421222.2019.1628889
how cyberpsychology and virtual reality can help us to overcome the psychological burden of coronavirus.,"riva, giuseppe; wiederhold, brenda k.",2020,"cyberpsychology, behavior & social networking",,10.1089/cyber.2020.29183.gri
using virtual reality to promote the university brand: when do telepresence and system immersion matter?,"shen, jie(doreen); wang, yanyun(mia); chen, chen(crystal); nelson, michelle r.; yao, mike z.",2020,journal of marketing communications,,10.1080/13527266.2019.1671480
value formation with immersive technologies: an activity perspective.,"nussipova, gulnar; nordin, fredrik; srhammar, david",2020,journal of business & industrial marketing,,10.1108/JBIM-12-2018-0407
real?time analytic antialiased text for 3?d environments.,"ellis, a.; hunt, w.; hart, j.",2019,computer graphics forum,,10.1111/cgf.13757
"survey on depth perception in head mounted displays: distance estimation in virtual reality, augmented reality, and mixed reality.","el jamiy, fatima; marsh, ronald",2019,iet image processing,,10.1049/iet-ipr.2018.5920
15 years of research on redirected walking in immersive virtual environments.,"nilsson, niels christian; peck, tabitha; bruder, gerd; hodgson, eri; serafin, stefania; whitton, mary; steinicke, frank; rosenberg, evan suma",2018,ieee computer graphics & applications,,10.1109/MCG.2018.111125628
a virtual reality training application for adults with asperger's syndrome.,"rojo, diego; mayor, jesus; rueda, jose jesus garcia; raya, laura; potel, mike",2019,ieee computer graphics & applications,,10.1109/MCG.2018.2884272
anlisis y evaluacin de procesos de interactividad en entornos virtuales de aprendizaje.,"mercado borja, william enrique; guarnieri, griselda; lujn rodrguez, guillermo",2019,revista triloga,,10.22430/21457778.1213
omnidirectional 360 video coding technology in responses to the joint call for proposals on video compression with capability beyond hevc.,"ye, yan; boyce, jill m.; hanhart, philippe",2020,ieee transactions on circuits & systems for video technology,,10.1109/TCSVT.2019.2953827
interactive design of commercial space signage system based on object detection.,tingting lei; guangtian zou,2019,ingnierie des systmes d'information,,10.18280/isi.240310
??????? ??? ??????? ?????? ?? ?? ??.,???; ???,2017,journal of digital convergence,,10.14400/JDC.2017.15.5.353
mobile immersive computing: research challenges and the road ahead.,"han, bo",2019,ieee communications magazine,,10.1109/MCOM.001.1800876
human-centered vr design: five essentials every engineer needs to know.,"jerald, jason",2018,ieee computer graphics & applications,,10.1109/MCG.2018.021951628
??? ?? ??? ??? ???? ??? ?? ??? ??.,???,2018,journal of digital convergence,,10.14400/JDC.2018.16.11.185
virtual reality interventions for personal development: a meta-analysis of hardware and software.,"howard, matt c.",2019,human-computer interaction,,10.1080/07370024.2018.1469408
visual computing technologies to support the operator 4.0.,"segura, lvaro; diez, helen v.; barandiaran, iigo; arbelaiz, ander; lvarez, hugo; simes, bruno; posada, jorge; garca-alonso, alejandro; ugarte, ramn",2020,computers & industrial engineering,,10.1016/j.cie.2018.11.060
360? ???? ?? ?? ??? ???? ??? ??.,???; ???; ???,2017,journal of digital convergence,,10.14400/JDC.2017.15.11.463
adaptive image-space sampling for gaze-contingent real-time rendering.,"stengel, michael; grogorick, steve; eisemann, martin; magnor, marcus",2016,computer graphics forum,,10.1111/cgf.12956
a virtual environment to emulate tailors work.,"vitali, andrea; rizzi, caterina",2017,computer-aided design & applications,,10.1080/16864360.2016.1273584
specular reflections removal for endoscopic image sequences with adaptive-rpca decomposition.,"li, ranyang; pan, junjun; si, yaqing; yan, bin; hu, yong; qin, hong",2020,ieee transactions on medical imaging,,10.1109/TMI.2019.2926501
?? ??? ??? ?? ???? ????? ??.,???; ???; ???; ???,2017,journal of digital convergence,,10.14400/JDC.2017.15.5.443
a review of emerging industry 4.0 technologies in remanufacturing.,"kerin, mairi; pham, duc truong",2019,journal of cleaner production,,10.1016/j.jclepro.2019.117805
beaming into the news: a system for and case study of tele-immersive journalism.,"kishore, sameer; navarro, xavi; dominguez, eva; de la pena, nonny; slater, mel",2018,ieee computer graphics & applications,,10.1109/MCG.2017.2801407
effect of virtual reality meditation on sleep quality of intensive care unit patients: a randomised controlled trial,"lee, sy; kang, j",2020,intensive and critical care nursing,Article,10.1016/j.iccn.2020.102849
natural embedding of live actors and entities into 360 degrees virtual reality scenes,"chheang, v; jeong, s; lee, g; ha, js; yoo, kh",2020,journal of supercomputing,Article,10.1007/s11227-018-2615-z
comparison of gaze accuracy and precision in real-world and virtual reality,"pastel, s; chen, ch; martin, l; naujoks, m; petri, k; witte, k",2020,virtual reality,Article; Early Access,10.1007/s10055-020-00449-3
a novel method to enhance the touristic 360 degrees promotional video experience,"goncalves, g; melo, m; vasconcelos-raposo, j; bessa, m",2020,multimedia tools and applications,Article; Early Access,10.1007/s11042-020-09026-x
influence of virtual reality on visual parameters: immersive versus non-immersive mode,"yoon, hj; kim, j; park, sw; heo, h",2020,bmc ophthalmology,Article,10.1186/s12886-020-01471-4
using immersive virtual environments (ives) to conduct environmental design research: a primer and decision framework,"joseph, a; browning, mhem; jiang, s",2020,herd-health environments research & design journal,Article; Early Access,10.1177/1937586720924787
contextual sensory integration training via head mounted display for individuals with vestibular disorders: a feasibility study,"lubetzky, av; kelly, j; wang, z; gospodarek, m; fu, g; sutera, j; hujsak, bd",2020,disability and rehabilitation-assistive technology,Article; Early Access,10.1080/17483107.2020.1765419
"virtual reality nature experiences involving wolves on youtube: presence, emotions, and attitudes in immersive and nonimmersive settings","filter, e; eckes, a; fiebelkorn, f; bussing, ag",2020,sustainability,Article,10.3390/su12093823
efficacy of virtual reality in painting art exhibitions appreciation,"lin, cl; chen, sj; lin, rt",2020,applied sciences-basel,Article,10.3390/app10093012
arkaevision vr game: user experience research between real and virtual paestum,"pagano, a; palombini, a; bozzelli, g; de nino, m; cerato, i; ricciardi, s",2020,applied sciences-basel,Article,10.3390/app10093182
participatory design and evaluation of virtual reality games to promote engagement in physical activity for people living with dementia,"eisapour, m; cao, s; boger, j",2020,journal of rehabilitation and assistive technologies engineering,Article,10.1177/2055668320913770
deep into visual saliency for immersive vr environments rendered in real-time,"celikcan, u; askin, mb; albayrak, d; capin, tk",2020,computers & graphics-uk,Article,10.1016/j.cag.2020.03.006
accuracy and precision of stimulus timing and reaction times with unreal engine and steamvr,"wiesing, m; fink, gr; weidner, r",2020,plos one,Article,10.1371/journal.pone.0231152
virtual reality as a tool for environmental conservation and fundraising,"nelson, km; anggraini, e; schluter, a",2020,plos one,Article,10.1371/journal.pone.0223631
gaze tracking and point estimation using low-cost head-mounted devices,"lee, kf; chen, yl; yu, cw; chin, ky; wu, ch",2020,sensors,Article; Proceedings Paper,10.3390/s20071917
closed-loop attention restoration theory for virtual reality-based attentional engagement enhancement,"li, g; zhou, sh; kong, z; guo, my",2020,sensors,Article,10.3390/s20082208
the impact of a novel immersive virtual reality technology associated with serious games in parkinson's disease patients on upper limb rehabilitation: a mixed methods intervention study,"sanchez-herrera-baeza, p; cano-de-la-cuerda, r; ona-simbana, ed; palacios-cena, d; perez-corrales, j; cuenca-zaldivar, jn; gueita-rodriguez, j; de quiros, cbb; jardon-huete, a; cuesta-gomez, a",2020,sensors,Article,10.3390/s20082168
foveation pipeline for 360 degrees video-based telemedicine,"syawaludin, mf; lee, m; hwang, ji",2020,sensors,Article,10.3390/s20082264
read-the-game: system for skill-based visual exploratory activity assessment with a full body virtual reality soccer simulation,"ferrer, cdr; shishido, h; kitahara, i; kameda, y",2020,plos one,Article,10.1371/journal.pone.0230042
design of learning media in mixed reality for lao education,"kounlaxay, k; kim, sk",2020,cmc-computers materials & continua,Article,10.32604/cmc.2020.09930
walking with head-mounted virtual and augmented reality devices: effects on position control and gait biomechanics,"chan, zys; macphail, ajc; au, iph; zhang, jh; lam, bf; ferber, r; cheung, rth",2019,plos one,Article,10.1371/journal.pone.0225972
virtual reality for information visualization might just work this time,"thomas, bh",2019,frontiers in robotics and ai,Article,10.3389/frobt.2019.00084
virtual reality head-mounted display for endoscopically-assisted implant surgery,"matsuo, a; hamada, h; oba, h; shibata, k",2018,british journal of oral & maxillofacial surgery,Article,10.1016/j.bjoms.2018.04.002
immersive virtual reality and the developing child,"bailey, jo; bailenson, jn",2017,cognitive development in digital contexts,Article; Book Chapter,10.1016/B978-0-12-809481-5.00009-2
virtual reality design: how upcoming head-mounted displays change design paradigms of virtual reality worlds,"stein, c",2016,media tropes,Article,0
a novel earthquake education system based on virtual reality,"gong, xl; liu, yj; jiao, y; wang, bj; zhou, jc; yu, hy",2015,ieice transactions on information and systems,Article,10.1587/transinf.2015EDP7165
multi-modal interface realization for scenario-based immersive virtual reality experience simulator,"youn, jh; cha, br; eun-seokkim; ji, yk",2015,asia life sciences,Article,0
virtual reality visual feedback for hand-controlled scanning probe microscopy manipulation of single molecules,"leinen, p; green, mfb; esat, t; wagner, c; tautz, fs; temirov, r",2015,beilstein journal of nanotechnology,Article,10.3762/bjnano.6.220
molecular rift: virtual reality for drug designers,"norrby, m; grebner, c; eriksson, j; bostrom, j",2015,journal of chemical information and modeling,Article,10.1021/acs.jcim.5b00544
on the validity of virtual reality-based auditory experiments: a case study about ratings of the overall listening experience,"schoeffler, m; gernert, jl; neumayer, m; westphal, s; herre, j",2015,virtual reality,Article,10.1007/s10055-015-0270-8
"cybersickness provoked by head-mounted display affects cutaneous vascular tone, heart rate and reaction time","nalivaiko, e; davis, sl; blackmore, kl; vakulin, a; nesbitt, kv",2015,physiology & behavior,Article,10.1016/j.physbeh.2015.08.043
visual and proprioceptive adaptation of arm position in a virtual environment,"masumoto, j; inui, n",2015,journal of motor behavior,Article,10.1080/00222895.2015.1015674
effects of displays on visually controlled task performance in three-dimensional virtual reality environment,"lin, cj; chen, hj; cheng, py; sun, tl",2015,human factors and ergonomics in manufacturing & service industries,Article,10.1002/hfm.20566
facial performance sensing head-mounted display,"li, h; trutoiu, l; olszewski, k; wei, ly; trutna, t; hsieh, pl; nicholls, a; ma, cy",2015,acm transactions on graphics,Article; Proceedings Paper,10.1145/2766939
treating small animal phobias using a projective-augmented reality system: a single-case study,"wrzesien, m; botella, c; breton-lopez, j; gonzalez, ed; burkhardt, jm; alcaniz, m; perez-ara, ma",2015,computers in human behavior,Article,10.1016/j.chb.2015.01.065
maintaining balance when looking at a virtual reality three-dimensional display of a field of moving dots or at a virtual reality scene,"chiarovano, e; de waele, c; macdougall, hg; rogers, sj; burgess, am; curthoys, is",2015,frontiers in neurology,Article,10.3389/fneur.2015.00164
virtual aquatic garden based on fish schooling simulation,"kim, jy; lee, wh",2015,asia life sciences,Article,0
user experience of interactive virtual aquarium contents using head-mounted display (hmd),"kim, jy; kim, ys",2015,asia life sciences,Article,0
rapid p300 brain-computer interface communication with a head-mounted display,"kathner, i; kubler, a; halder, s",2015,frontiers in neuroscience,Article,10.3389/fnins.2015.00207
posttraumatic stress disorder: possibilities for olfaction and virtual reality exposure therapy,"aiken, mp; berry, mj",2015,virtual reality,Article,10.1007/s10055-015-0260-x
towards an assistive peripheral visual prosthesis for long-term treatment of retinitis pigmentosa: evaluating mobility performance in immersive simulations,"zapf, mph; boon, my; matteucci, pb; lovell, nh; suaning, gj",2015,journal of neural engineering,Article,10.1088/1741-2560/12/3/036001
comparing the effectiveness of different displays in enhancing illusions of self-movement (vection),"riecke, be; jordan, jd",2015,frontiers in psychology,Article,10.3389/fpsyg.2015.00713
coordinated hybrid virtual environments: seamless interaction contexts for effective virtual reality,"wang, j; lindeman, r",2015,computers & graphics-uk,Article,10.1016/j.cag.2015.02.007
slim near-eye display using pinhole aperture arrays,"aksit, k; kautz, j; luebke, d",2015,applied optics,Article,10.1364/AO.54.003422
affordance judgments in hmd-based virtual environments: stepping over a pole and stepping off a ledge,"lin, qf; rieser, j; bodenheimer, b",2015,acm transactions on applied perception,Article,10.1145/2720020
"interactive cervical motion kinematics: sensitivity, specificity and clinically significant values for identifying kinematic impairments in patients with chronic neck pain","bahat, hs; chen, xq; reznik, d; kodesh, e; treleaven, j",2015,manual therapy,Article,10.1016/j.math.2014.10.002
wave: interactive wave-based sound propagation for virtual environments,"mehra, r; rungta, a; golas, a; lin, m; manocha, d",2015,ieee transactions on visualization and computer graphics,Article; Proceedings Paper,10.1109/TVCG.2015.2391858
3d finger cape: clicking action and position estimation under self-occlusions in egocentric viewpoint,"jang, y; noh, st; chang, hj; kim, tk; woo, w",2015,ieee transactions on visualization and computer graphics,Article; Proceedings Paper,10.1109/TVCG.2015.2391860
assessing knowledge retention of an immersive serious game vs. a traditional education method in aviation safety,"chittaro, l; buttussi, f",2015,ieee transactions on visualization and computer graphics,Article; Proceedings Paper,10.1109/TVCG.2015.2391853
the oculus rift: a cost-effective tool for studying visual-vestibular interactions in self-motion perception,"kim, j; chung, cyl; nakamura, s; palmisano, s; khuu, sk",2015,frontiers in psychology,Article,10.3389/fpsyg.2015.00248
weavr: a self-contained and wearable immersive virtual environment simulation system,"hodgson, e; bachmann, er; vincent, d; zmuda, m; waller, d; calusdian, j",2015,behavior research methods,Article,10.3758/s13428-014-0463-1
eye height manipulations: a possible solution to reduce underestimation of egocentric distances in head-mounted displays,"leyrer, m; linkenauger, sa; bulthoff, hh; mohler, bj",2015,acm transactions on applied perception,Article,10.1145/2699254
the accuracy of the oculus rift virtual reality head-mounted display during cervical spine mobility measurement,"xu, x; chen, krb; lin, jh; radwin, rg",2015,journal of biomechanics,Article,10.1016/j.jbiomech.2015.01.005
virtual reality-based pilot training for underground coal miners,"grabowski, a; jankowski, j",2015,safety science,Article,10.1016/j.ssci.2014.09.017
the content of professional activity as a factor of application efficiency of virtual reality technology,"kovalev, ai; menshikova, gy; klimova, oa; barabanshikova, vv",2015,eksperimentalnaya psikhologiya,Article,10.17759/exppsy.2015080205
usability evaluation of vr interface for mobile robot teleoperation,"jankowski, j; grabowski, a",2015,international journal of human-computer interaction,Article,10.1080/10447318.2015.1039909
testing the mechanisms underlying improved distance judgments in virtual environments,"kunz, br; creem-regehr, sh; thompson, wb",2015,perception,Article,10.1068/p7929
stereoscopic visualization and 3-d technologies in medical endoscopic teleoperation,"livatino, s; de paolis, lt; d'agostino, m; zocco, a; agrimi, a; de santis, a; bruno, lv; lapresa, m",2015,ieee transactions on industrial electronics,Article,10.1109/TIE.2014.2334675
the new dawn of virtual reality in health care: medical simulation and experiential interface,"riva, g; wiederhold, bk",2015,annual review of cybertherapy and telemedicine 2015: virtual reality in healthcare: medical simulation and experiential interface,Article; Book Chapter,10.3233/978-1-61499-595-1-3
"virtual reality for the assessment of frontotemporal dementia, a feasibility study","mendez, mf; joshi, a; jimenez, e",2015,disability and rehabilitation-assistive technology,Article,10.3109/17483107.2014.889230
use of auditory event-related potentials to measure immersion during a computer game,"burns, cg; fairclough, sh",2015,international journal of human-computer studies,Article,10.1016/j.ijhcs.2014.09.002
new wireless connection between user and ve using speech processing,"mirzaei, ma; merienne, f; oliver, jh",2014,virtual reality,Article,10.1007/s10055-014-0248-y
aerial full spherical hdr imaging and display,"okura, f; kanbara, m; yokoya, n",2014,virtual reality,Article,10.1007/s10055-014-0249-x
tomorrow's hospital how technology will be transforming both inpatient and at-home care,"chandler, dl",2014,ieee pulse,Article,10.1109/MPUL.2014.2355298
design of a naturalistic navigational virtual reality using oculus rift,"byagowi, a; singhal, s; lambeta, m; aldaba, c; moussavi, z",2014,journal of medical devices-transactions of the asme,Article; Proceedings Paper,10.1115/1.4027114
an augmented reality home-training system based on the mirror training and imagery approach,"trojan, j; diers, m; fuchs, x; bach, f; bekrater-bodmann, r; foell, j; kamping, s; rance, m; maass, h; flor, h",2014,behavior research methods,Article,10.3758/s13428-013-0412-4
the use of immersive virtual reality (vr) to predict the occurrence 6 months later of paranoid thinking and posttraumatic stress symptoms assessed by self-report and interviewer methods: a study of individuals who have been physically assaulted,"freeman, d; antley, a; ehlers, a; dunn, g; thompson, c; vorontsova, n; garety, p; kuipers, e; glucksman, e; slater, m",2014,psychological assessment,Article,10.1037/a0036240
distance estimation of near-field visual objects in stereoscopic displays,"lin, cj; woldegiorgis, bh; caesaron, d",2014,journal of the society for information display,Article,10.1002/jsid.269
feasibility of articulated arm mounted oculus rift virtual reality goggles for adjunctive pain control during occupational therapy in pediatric burn patients,"hoffman, hg; meyer, wj; ramirez, m; roberts, l; seibel, ej; atzori, b; sharar, sr; patterson, dr",2014,cyberpsychology behavior and social networking,Article,10.1089/cyber.2014.0058
sense of presence and anxiety during virtual social interactions between a human and virtual humans,"morina, n; brinkman, wp; hartanto, d; emmelkamp, pmg",2014,peerj,Article,10.7717/peerj.337
dynamic affordances in embodied interactive systems: the role of display and mode of locomotion,"grechkin, ty; plumert, jm; kearney, jk",2014,ieee transactions on visualization and computer graphics,Article; Proceedings Paper,10.1109/TVCG.2014.18
virtual reality interface devices in the reorganization of neural networks in the brain of patients with neurological diseases,"gatica-rojas, v; mendez-rebolledo, g",2014,neural regeneration research,Article,10.4103/1673-5374.131612
iview: an interactive webgl visualizer for protein-ligand complex,"li, hj; leung, ks; nakane, t; wong, mh",2014,bmc bioinformatics,Article,10.1186/1471-2105-15-56
testing of visual field with virtual reality goggles in manual and visual grasp modes,"wroblewski, d; francis, ba; sadun, a; vakili, g; chopra, v",2014,biomed research international,Article,10.1155/2014/206082
visual capture and the experience of having two bodies - evidence from two different virtual reality techniques,"heydrich, l; dodds, tj; aspell, je; herbelin, b; bulthoff, hh; mohler, bj; blanke, o",2013,frontiers in psychology,Article,10.3389/fpsyg.2013.00946
cervicocephalic kinaesthesia in subjects with and without peripherally induced pain,"ramsayer, b; honold, m; beck, k; kraus, m; kramer, m; dehner, c",2013,journal of musculoskeletal pain,Article,10.3109/10582452.2013.851760
near-eye light field displays,"lanman, d; luebke, d",2013,acm transactions on graphics,Article; Proceedings Paper,10.1145/2508363.2508366
effects of providing personalized feedback of child's obesity risk on mothers' food choices using a virtual reality buffet,"mcbride, cm; persky, s; wagner, lk; faith, ms; ward, ds",2013,international journal of obesity,Article,10.1038/ijo.2013.87
pshychological influences on distance estimation in a virtual reality environment,"takahashi, k; meilinger, t; watanabe, k; bulthoff, hh",2013,frontiers in human neuroscience,Article,10.3389/fnhum.2013.00580
illusory ownership of a virtual child body causes overestimation of object sizes and implicit attitude changes,"banakou, d; groten, r; slater, m",2013,proceedings of the national academy of sciences of the united states of america,Article,10.1073/pnas.1306779110
altered steering strategies for goal-directed locomotion in stroke,"aburub, as; lamontagne, a",2013,journal of neuroengineering and rehabilitation,Article,10.1186/1743-0003-10-80
"seeing and ""feeling"" architecture: how bodily self-consciousness alters architectonic experience and affects the perception of interiors","pasqualini, i; llobera, j; blanke, o",2013,frontiers in psychology,Article,10.3389/fpsyg.2013.00354
exploiting perceptual limitations and illusions to support walking through virtual environments in confined physical spaces,"bruder, g; steinicke, f; bolte, b; wieland, p; frenz, h; lappe, m",2013,displays,Article,10.1016/j.displa.2012.10.007
validation of the mr simulation approach for evaluating the effects of immersion on visual analysis of volume data,"laha, b; bowman, da; schiffbauer, jd",2013,ieee transactions on visualization and computer graphics,Article; Proceedings Paper,10.1109/TVCG.2013.43
egocentric distance perception in large screen immersive displays,"piryankova, iv; de la rosa, s; kloos, u; bulthoff, hh; mohler, bj",2013,displays,Article,10.1016/j.displa.2013.01.001
head stabilization shows visual and inertial dependence during passive stimulation: implications for virtual rehabilitation,"wright, wg; agah, mr; darvish, k; keshner, ea",2013,ieee transactions on neural systems and rehabilitation engineering,Article,10.1109/TNSRE.2012.2237040
perceiving affordances in virtual reality: influence of person and environmental properties in perception of standing on virtual grounds,"regia-corte, t; marchal, m; cirio, g; lecuyer, a",2013,virtual reality,Article,10.1007/s10055-012-0216-3
virtual reality for assessment of patients suffering chronic pain: a case study,"llobera, j; gonzalez-franco, m; perez-marcos, d; valls-sole, j; slater, m; sanchez-vives, mv",2013,experimental brain research,Article,10.1007/s00221-012-3352-9
an evaluation of targeting accuracy in immersive first-person shooters comparing different tracking approaches and mapping models,"garcia, as; olivas, a; molina, jp; martinez, j; gonzalez, p; martinez, d",2013,journal of universal computer science,Article,0
development of an augmented reality-oriented game system for stroke rehabilitation assessment,"lee, rg; tien, sc; chen, cc; chen, yy",2012,biomedical engineering-applications basis communications,Article,10.4015/S1016237212500391
extending body space in immersive virtual reality: a very long arm illusion,"kilteni, k; normand, jm; sanchez-vives, mv; slater, m",2012,plos one,Article,10.1371/journal.pone.0040867
interactive visibility retargeting in vr using conformal visualization,"petkov, k; papadopoulos, c; zhang, m; kaufman, ae; gu, xd",2012,ieee transactions on visualization and computer graphics,Article,10.1109/TVCG.2011.278
does pre-exposure inhibit fear context conditioning? a virtual reality study,"troger, c; ewald, h; glotzbach, e; pauli, p; muhlberger, a",2012,journal of neural transmission,Article,10.1007/s00702-011-0757-8
